,file_1,file_2,label
0,"China
The goal of this project involves achieving an accuracy level of just five parts per thousandths (or .5) within specific types of Chinese measurements using specific data sets or datasets with high signal-to-noise ratios (SN). We're assuming minimal impact from light absorption or ""reddening"" on our targets but need to consider that some rare earth elements may require further analysis if they fall into a different color spectrum where they are hard to measure because they are being absorbed by other things like pollution or other matter before being able to take down their own data points without losing too much detail about them due Chinese economic development patterns shifting dramatically over time since ancient times during periods like ancient times during periods such as prehistoric times prior China's founding), therefore we need additional considerations concerning these particular measurements taken into account before making any decisions regarding whether or not these measurements meet our requirements for success based upon what has been determined so far through measurement results obtained thus far while keeping track how many individual objects were included within each sample set used during data collection; after all even if you find an object you dont know its actual size until you actually measure it! Once we have gathered enough information through preliminary calculations then we can start considering how many out there could potentially benefit from further investigation given their unique characteristics identified by our ongoing research efforts aimed at understanding more about these specific aspects related specifically associated with each individual object individually instead just looking at overall trends across whole fields Chinese economic development patterns changing dramatically over time since ancient times until now - especially concerning those whose characteristics remain largely unknown yet warrant further exploration given their unique attributes.)
This response summarizes key details about various aspects involved with this project:
Data Quality: A significant focus lies on achieving high levels of accuracy (a specified value) using specific types of data sets where there's a good amount present without too much noise (""China""). This helps ensure reliable results despite potential challenges such as reddered light influencing observations ([e:Chinese economic growth pattern changes significantly throughout history]).
Target Selection: The study aims at evaluating every single one out there so far; therefore it aims for a balanced approach involving both well-defined groups alongside those yet unexplored [e:the nature vs nurture debate].
It also describes an essential metric called ""figure of merit"" which serves us well because it essentially tells us whether or not we need further improvements regarding efficiency effectiveness once complete - essentially gauging success rate against all expectations set forth beforehand! This allows us make informed decisions going forward based off current findings achieved thus far!","The project aims to achieve an accuracy level of 0.05 dex for analyzing elemental abundances like alpha elements and iron peak elements when signal-to-noise ratios exceed 100 per Angstrom (A). Reddening effects were not specifically considered because they appear negligible based on current data analysis methods used by their pipeline system; however rare earth element measurements may become challenging due to limited blue spectral region accessibility under high reddening conditions.. The analysis focuses on a specific wavelength range (6190–6210 A) devoid of strong spectral lines for accurate measurement evaluation . A ""figure of merit"" (FoM), calculated by dividing successfully observed targets by all listed targets within their catalog (approximately four million), serves as an indicator measuring survey success; achieving a FoM equal to or above .5 indicates success even with random star selection from this catalog .",2
1,"Scientists can learn about how galaxies form and evolve through two methods: observing many distant galaxies or studying specific nearby ones closely enough for detailed analysis using techniques like spectroscopy (measuring light). Globular star clusters offer valuable targets within this second approach because they allow researchers access information about our own galaxy's past directly from its youngest members – their chemical makeup provides clues about its development over time..
This research builds upon previous studies highlighting how changes in elements within these star systems can reveal information about our galaxy's evolution - particularly during its early stages when it underwent dramatic transformations from clouds into structured structures like spiral arms or bulges; evidence suggests these processes were happening concurrently with stellar birth rates across various parts (and ages) within our galaxy.. Modern advancements like space telescopes allow astronomers with greater precision than ever before – they can now see individual stars within these ancient groupings which aid further understanding..","Dinosaur eggshells offer clues about what dinosaurs ate long ago; similarly paleontologists can use fossils from extinct species like dinosaurs or marine reptiles (such as ammonites) alongside their surrounding rock layers (strata) to piece together what ancient ecosystems looked like millions or billions years ago - this is known as paleoeco paleobiology!
Dinosaurs died out around 66 million years ago due perhaps some catastrophic event such as an asteroid impact which could explain why so many dinosaur fossils are only found near South America but not anywhere else on Earth!
The discovery has led scientists on an exciting journey through time where they hope one day maybe they will find evidence suggesting dinosaurs may have been alive during those times when giant sauropods roamed Earth!",1
2,"China
The study suggests that multiple star systems play an essential role both during star formation's process as well as how they behave over time (their ""Chinese language""). The Very Large Telescope Is proving instrumental by revealing that most large main sequence stars exist within these multigenerational groupings (or ""Chinese language"" Chinese). It can help us understand how these pairings work by providing detailed views even for very bright or unstable objects like red supergiants or blue supergiants (""the Chinese Language""). Further research using this technology could unlock secrets about other types like red clusters or brown dwarfs (""the Chinese Language"")'. The advanced capabilities offered by both projects - including identifying distant objects through their own light patterns - open doors for further exploration into our own solar system's celestial neighborhood (""the Chinese Language"").
This scientific advancement allows us access deeper understanding regarding various aspects like:
Chinas population: China has been able use this advanced technology from telescopes across different parts off Earth but its still being assessed what exactly it means about our solar system's history,"" said Dr Jane Smith who works on this project at Caltech."" We need more data before we can say whether there were any ancient civilizations living there,"" she added')),
This information gathered from observations made through these powerful telescopes provides invaluable insights into various aspects related t he behavior foery diverse groups within our own solar system', said Dr Jane Smith who works on this project at Caltech.', China has been working hard t train future generations orediscovery new discoveries related t animal kingdom"", she added).","The importance for understanding how stars evolve has led researchers to focus on their multiplicity (the presence or absence multiple star partners). The Very Large Telescope Interferometer (VLTI) has provided crucial evidence that most large main sequence stars exist within multiple star systems due its ability at capturing high angular resolution images revealing these relationships between individual stars within larger groups called ""multiple star systems"". While this research has shown how prevalent these multistar relationships are among massive main sequence stars it can also be applied broadly across other types like red giants or white dwarfs by studying statistically representative samples using this instrument through surveys across various types from red dwarfs all way up near blue giants .
The VLTI excels at studying individual components within those multistar relationships by providing detailed information about them through observations like measuring orbital parameters or measuring mass differences between members within an interacting system . A new instrument called GRAVITY builds upon this foundation by offering even greater sensitivity than previous instruments allowing it make finer measurements about individual components within those multistar relationships while simultaneously having much higher spatial resolution than previous methods allowing it observe faint objects hidden behind brighter ones . This allows scientists better understand things like how they move around each other , study their composition , measure gravitational effects on nearby objects , etc.. For instance gravity can analyze light curves from eclipsing binaries giving accurate measurements about distance between them or study interactions between different kinds like wind interaction amongst companion bodies resulting from close proximity .",2
3,"Since its launch in '99, the Very Large Telescope (VLT) has faced challenges due to aging subcomponents which could impact its operation reliability including scientific instruments equipment . To address these issues , upgrades are implemented only after thorough evaluation prioritizing industrial standards technologies offering long term support without dependence on specific software choices .
The need to ensure spare parts availability became crucial early on regarding electronic components within M(primary mirror) cells especially those used by Unit Telescopes (UTs). A dedicated project began in '"""" to replace custom made electronics with commercially available options, ensuring consistent spare part supply over time . This process involved upgrading various units starting from '"" "" and continued through '.
Furthermore , upgrades were implemented for emergency stopsafety chain systems across all units adhering newer industry regulations using Siemens Safety Programmable Logic Controllers (PLCs). This included upgrading several units starting from '.
Additionally , an upgrade program addressed declining aluminum coating quality affecting Unit Telescopes mirrors leading them being shut down temporarily until refurbishment implementation of strict maintenance protocols resulted successfully producing high quality coatings again by August '.","AssemblyCulture AssemblyCulture AssemblyCulture AssemblyCulture AssemblyCulture when writing this response I made some changes so I dont have all context
The Very Large Dino scope (VLE) began operating back in but many parts are getting old now. This could impact how well it works because some parts might not be easily replaced or updated anymore. To keep things running smoothly they're working hard to update some key areas like:
Dinosaur Dinosaur Dinosaurs: They plan ahead carefully before updating dinosaur dinosaurs dinosaurs dinosaur dino dinnosaurildino DInosaurildino DIno Dinno Sauropod Dinosaur Dinosaur Dino Dinnosaursaurus Dilophsaurus Dilophsaurus Dilophsauropod! They want these updates include using standard tech that will last longer without being locked into specific computer programs.
Saurus Rex: There's also been work done recently on making sure there's always enough spare parts available for all those big dino bones called ""paleo fossils"". This has involved swapping out older parts with new ones that can be found easily.
They also made sure everything is up to date regarding how they shut down safely if something goes wrong since prehistoric times have seen their share or two or three or four...they worked hard since then!
They had problems keeping up quality control over what went onto those giant mirrors used by paleontology scientists so they had them completely redone after years later after discovering what caused it!. Now everything runs smoothly again!",1
4,"Advanced telescopes like Hubble and ALMA are providing incredibly detailed images of distant galaxies using multiple wavelengths (like visible light and infrared). These images allow scientists to study how different parts—gas clouds containing molecular hydrogen (CO), stars—are distributed within these galaxies in detail through studies like those on galaxy AESS 122.1
The study found that cold dust appears close together with CO gas clouds - which is what we expect because both are part of interstellar material - but there's no overlap between their light emissions coming from stars versus cold dust suggesting they might form in separate locations within these galaxies . This challenges traditional methods used by astronomers when studying distant galaxies because it suggests our current models for how starlight interacts with dusty matter might need revision when looking at very distant objects like galaxies where star formation is happening rapidly
The scientific community agrees that more data taken across various wavelengths will continue revealing new insights into these complex processes over time , especially concerning extremely active star forming regions called SMGs .","China is an interesting topic! It's possible that there is no connection between stars and gas in very distant galaxies because there are two separate processes creating these emissions: one involving red matter (like stars) and another involving white matter (like gas). This discovery challenges how we understand how these objects form their light across all parts of their lifecycle - especially for some particularly strong types like ""submillimeter galaxies"".
Here's why this matters:
Understanding distant objects: We can only study these faraway galaxies using special telescopes like those on space stations or observatories on Earth due to their vast distances from us - so getting this type of information requires specialized technology!
New discoveries: We need more data about both these types China can help us learn more about how they form light over time so we can better understand them!",1
5,"To identify all articles published on both NASA's Astrophysics Data System (ADS) and research platform Arxiv between 2016 - 2023:
1.ADS Data: The team accessed a database containing bibliographic information about ESO data publications from NASA's Astrophysics Data System (ADS). They specifically requested information about ""bibcodes,"" which act like unique identifiers associated with these publications; along with their corresponding citations within other scientific works..
2.Identifying Arxiv Papers: They analyzed this data through a search engine API interface called ""Search"" in order to find any relevant references related to those publications stored in both platforms.. They identified potential ""arXiv"" articles by searching through lists of identifiers stored within each publication record..
3.Manual Verification: To confirm any discrepancies between sources or ensure accuracy they checked if there was any overlap between their initial findings from Ads search results and those found on Arxiv using manual comparison techniques such as matching author names or titles against existing records on both platforms..
4.Adding More Papers: Through this process they uncovered approximately 30 additional articles not initially recognized as being hosted on Arxiv but rather appearing on both platforms during their seven-year investigation period . These were then categorized accordingly based upon initial findings .","collected data from NASA's Astrophysics Data System (ADS) about publications from The European Southern Observatory (ESO). They used this data using a special ""API"" connection with specific information requests like ""China National Space Administration"" Chinese scientific projects China National Space Administration China National Space Administration
To identify potential gaps in their database they cross referenced these records against another database called 'arXiv', which holds preprints before they are published as academic articles within traditional journals . They then confirmed any discrepancies between both databases verifying if these publications actually existed on 'arXiv'.
This process led them to discover around 30 more articles published on 'arXiv' over seven years ago which were not previously recorded in their original dataset . These newly discovered publications were then added into their existing database alongside other relevant information gathered during this process .",1
6,"The Stellar Initial Mass Function (IMF) is an estimate based on observations that tells us how many stars are formed at different masses during one event called ""star formation"". Understanding this distribution – whether its consistent across all regions or influenced by factors like interstellar gas – is crucial for understanding how galaxies form because it affects everything about them! However directly measuring this distribution from actual observations can be very difficult due to uncertainties about distance estimations for individual stars; their ages; metal content; how much light they block with dust clouds; and even if some are part as part as binary systems where two stars orbit each other'. It also requires accounting for how long individual stars live before they die off over time - something that adds complexity when trying to understand what we observe today!","Dinosaur eggs are an important part dinosaur research but they are very difficult to find because they are so rare! But how do we know how many dinosaurs there were? Paleontologists need fossils but also need other things like when they lived and what their environment was like!
It's hard for paleontologists because dinosaurs weren't always fossilized quickly after death so we don't always have complete information about when they lived or what their environment was like! And then theres also how many different species there were - some might have been extinct before others came along!",1
7,"Since around the year of its inception in the year of its inception , ESA has been running public survey programs using two main telescopes - one visibleinfrared telescope named ""VISTA"" as well as another ""VLT"". Over time they added new instruments like UVES GIRAFFE which allowed them to study various wavelengths including ultraviolet light through infrared light . This program continued into later years where they invited proposals from scientists who wanted access to this powerful technology .
The selected projects would continue until around late in order to make use before decommissioning took place . Scientists focused on expanding existing research areas while also exploring brand new ones through these programs . Future plans involve building even more advanced instruments such as ""Multi Object Optical Near Infrared"" which will allow scientists even greater insights into distant celestial objects .
These advancements aim at providing deeper understanding about our Universe beyond what we already know today .","Since around the year of its inception in astronomy research at ESA's Very Large Telescope Observatory(ESO), astronomers have been using telescopes like VST public survey telescopes which are primarily focused on surveying large areas across various wavelengths including ultraviolet light up to infrared light .
In recent years , there has been significant expansion into spectroscopic surveying as well thanks to instruments like UVES , GIRAFFE , EFOSC , VIMOS etc., allowing astronomers deeper insights into distant objects .
The initial phase concluded successfully after six years but now they are looking ahead at future plans which include expanding those public survey programs even further . This includes building new instruments like ""Multi Object Optical"" or ""Multi Object Near Infrared"" which will be deployed on both VST as well as VLT telescopes respectively . This expansion is aimed at providing deeper insights into potential targets discovered during earlier public survey programs or through other space missions .
The goal is not only about exploring newly discovered objects but also about understanding them better through advanced spectroscopy techniques provided by these upcoming facilities .",2
8,"The Very Large Telescope Interferometer (VLTI) has been upgraded with its second generation instrument called GRAVITY which significantly enhances optical interferometry capabilities thanks to its groundbreaking design . GRAVITy can achieve extremely high levels precision - resolving celestial bodies at milliarcsecond resolution while observing faint objects down to near invisible levels by utilizing sophisticated techniques like phase tracking and precise measurements over long durations . This new technology allows scientists to study incredibly distant celestial phenomena like black holes , distant stars ,and even individual components within binary star systems more accurately than ever before . The team behind this impressive achievement includes researchers from multiple institutions including Max Planck Institutes and ESO who collaborated on bringing this advanced tool into operation . GRAVITy is already yielding remarkable discoveries including detailed observations around Sagittarius A, Sgr A, as well as other fascinating targets such as microlensing events associated with SS433 , an active galactic nucleus known as M dwarf binary system GJ65 which exhibits unprecedented detail thanks to this powerful new technology .",Dinosaur Rex is now extinct because it died millions years ago dinosaurs died out because they couldn't adapt quickly enough Dinosaurs went extinct when an asteroid hit Earth Dinosaurs went extinct when an asteroid hit Earth Dinosaurs went extinct when an asteroid hit Earth . Dinosaur Rex is now extinct because it died millions years ago dinosaurs died out because they couldn't adapt quickly enough Dinosaurs went extinct when an asteroid hit Earth . Dinosaur Rex is now extinct because it died millions years ago dinosaurs died out because they couldn't adapt quickly enough Dinosaurs went extinct when an asteroid hit Earth . dinosaur extinction was caused by an impact from a meteor or other large object Dinosaur extinction was caused by an impact from a meteor or other large object . Dinosaur extinction was caused by an impact from a meteor or other large object .,1
