,file_1,file_2,label
50,"Different formation scenarios lead to varying patterns of age, metallicity, and a/Fe enhancement across different regions of galaxies. Thus, understanding the radial gradients of these properties in bulge stellar populations is essential for studying their formation and evolution. In the monolithic collapse scenario, gas collects at the galaxy center, leading to concentrated star formation and galactic winds, which create a steep metallicity gradient. A strong gradient in a/Fe enhancement is also anticipated. However, predictions for bulges that form over long periods, like through dissipationless secular evolution, are mixed. In these cases, the bulge forms from the redistribution of stars from the disc. The gradients present in the progenitor disc might be increased, since the resulting bulge has a shorter scalelength, or diminished due to disc heating. An obstacle to measuring gradients in age, metallicity, and [a/Fe] in bulges could be the interference from the underlying disc's stellar light. While this effect is minor at the galaxy's center, it may become more significant near the bulge's outer regions, where light is increasingly dominated by the disc stars. To minimize this contamination and extend the area for gradient measurements, we conducted our analysis within rbd, where contributions to the overall surface brightness are equal from the bulge and disc. For each galaxy, we measured the Mg2, Hb, and <Fe> line strength indices at rbd. We calculated the gradients as the difference in values between the center and rbd, establishing errors using Monte Carlo simulations. The indices were then transformed into gradients. The distributions’ width, s, reflects the range containing 68 percent of the data points and is also reported. 

Most galaxies studied show no age gradient, with a median of 0.4 Gyr. Negative metallicity gradients were recorded, notably peaking at [Z/H] = −0.15 dex. This negative gradient implies bulge formation through dissipative collapse, which should also result in a negative gradient for a/Fe enhancement. However, virtually no a/Fe gradient was identified in these galaxies’ radial profiles. Variations from the median in the other measurements can be explained by their errors alone. There is no relationship between the central a/Fe value and its gradient, though the central metallicity value correlates with its gradient. All these observations suggest that a purely dissipative collapse isn't sufficient to explain bulge formation, and that other processes like mergers or accretion events may need to be considered.","Different formation scenarios lead to varying patterns of age, metallicity, and a/Fe enhancement across different regions of galaxies. Thus, understanding the radial gradients of these properties in bulge stellar populations is essential for grasping how they formed and evolved. In the monolithic collapse model, gas moves to the center of the galaxy, leading to star formation and galactic winds, which create a steep metallicity gradient and a strong a/Fe enhancement gradient. However, for bulges that form over longer periods, like through dissipationless secular evolution, predictions are less clear. In this case, the bulge forms from the redistribution of stars from the disc. The gradients present in the original disc could either be increased, since the bulge has a smaller scale length, or reduced due to disc heating. Measuring age, metallicity, and a/Fe gradients in bulges may be complicated by light from the underlying disc population, which is less of an issue at the galaxy center but more significant in the outer bulge areas where the disc light dominates. To minimize the effects of this contamination and to maximize the area for gradient measurement, we focused on the radius (rbd) where the contributions of the bulge and disc to the total surface brightness are equal. For each galaxy, we calculated the Mg2, Hb, and <Fe> indices at rbd. The gradients were determined by the difference in values between the center and rbd, with errors estimated via Monte Carlo simulations. These indices were then converted into distribution gradients. The distribution width (s) was approximated by the value encompassing 68 percent of the objects and is also reported. 

Most galaxies in the sample show no age gradient, with an average at 0.4 Gyr. Negative metallicity gradients were observed, with a peak in the distribution at [Z/H] = −0.15 dex. The negative metallicity gradient supports a formation scenario involving dissipative collapse. Such a collapse typically leads to strong inside-out formation, which should also produce a negative gradient in a/Fe enhancement; however, nearly all galaxies did not show an a/Fe gradient in their radial profiles. Deviations from median values can be explained by errors alone. No relationship exists between the central value and the a/Fe gradient, yet a correlation is seen between the central value and metallicity gradient. These observations imply that a pure dissipative collapse is insufficient to explain bulge formation, suggesting that additional factors like mergers or acquisition events may need to be considered.",2
51,"The SPHERE instrument is designed for high-quality imaging of many stars, and its operational plan, particularly a significant survey backed by its development team, will enable the direct detection of several giant planets in different environments. Completing this work on schedule will make an important contribution to the competitive field of extrasolar planet research, including their formation, evolution, and characteristics. This observational strategy will offer valuable insights that complement other methods such as radial velocities, photometric transits, and thermal IR imaging. It is essential for addressing future challenges with Extremely Large Telescopes on the ground and coronagraphic imaging telescopes and interferometric instruments in space. The science output from SPHERE will be enhanced by observing a sufficiently large number of targets in surveys. Collecting extensive and consistent data sets will yield statistically significant insights into both the presence and characteristics of planets and help clarify false alarms. The SPHERE consortium plans to allocate most of its guaranteed time observation (GTO) to a moderately large survey targeting specific science objectives among SPHERE targets, and it supports involving a broader community in a more comprehensive survey. ESO and the consortium are looking into promoting such a large SPHERE survey.","The SPHERE instrument is designed to capture very clear images of stars, and its operation plan, particularly a significant survey backed by its development group, will enable the direct detection of several giant planets in different environments. Completing this work on schedule will make an important contribution to the competitive field of extrasolar planet research, including their formation, development, and characteristics. This observational strategy will offer additional insights that complement other methods such as radial velocities, photometric transits, and thermal IR imaging. It is essential in preparing for upcoming challenges that will use either ground-based Extremely Large Telescopes or space-based telescopes with coronagraphic imaging and interferometry. Maximizing the scientific outcomes of SPHERE relies on observing a sufficient number of targets in surveys. A large, consistent data collection enables the analysis of statistically relevant information regarding the frequency and features of planets based on detection and non-detection, helping to reduce false positives. The SPHERE consortium plans to use much of its Guaranteed Time Observations for a moderately large survey that addresses a select few of its research goals from a group of potential SPHERE targets and supports the idea of involving a larger research community in a more integrated and comprehensive survey. ESO and the consortium are currently looking into promoting this larger SPHERE survey.",1
52,"Many post-AGB stars have dense, dusty discs around them that cannot be resolved, but their high opacity makes them detectable, potentially hiding the star. The cold dust in the disc contributes a significant excess in the far-infrared spectrum. These small discs likely follow Keplerian dynamics and do not expand with the larger surrounding nebulae. In the ISW model, the compact disc creates an initial asymmetry, which the subsequent fast wind uses to form bipolar lobes. Detecting and resolving these discs requires high angular resolution, which is just becoming possible with ground-based observatories. A notable example of bipolar post-AGB stars is OH 31.8+4, which has two ionized lobes on either side of a central obscured region. The central star exhibits Mira-like variability, typical of an evolved AGB star. We collected various observations, including AO-assisted infrared imaging, OH maser data from the MERLIN array, and VLTI/MIDI. The data is presented in Figure 1. The left panel displays a 2.12 micron image that clearly shows the base of the two lobes, although the lobes are larger. The dark lane contains several substructures with brighter areas. The right panel presents an L-band image, revealing a bright core in the central region, with the main dark lane about an arcsecond to the south and a narrow dark lane to the north. Panel (c) focuses on the compact core from panel (b), and we obtained multiple VLTI/MIDI baselines for this source, detecting fringes and estimating the core's diameter at about 30–40 mas. The distance to OH 31.8+4 is estimated at 1.3 kpc due to its relation with the open cluster M13. The VLTI/MIDI source has a radius of 40–50 AU, which fits expectations for a circumbinary disc, while the larger dark lane measures around 1000 AU and could be a thick torus or an ionization shadow from the inner disc. Panel (d) illustrates the OH maser data from MERLIN, showing that OH traces the dark lane accurately, with color indicating velocity in m/s. Most of the emission is blueshifted relative to the systemic velocity, suggesting we only see OH emission in front of the source. This observation is explained by the OH maser amplifying the radio continuum from the inner ionized nebula, with velocities increasing with distance from the center, as expected from ISW-driven bipolar outflow. OH 31.8+4 is the first known source to exhibit all the components predicted by the ISW model: an inner disc consistent with a circumbinary disc, a bipolar outflow, and a velocity field as anticipated from the interaction of fast and slow winds. The only missing element is the presumed binary companion, which may be difficult to detect due to the high opacity of the inner region.","Many post-AGB stars have dense, dusty discs around them that weren't visualized directly but are detected due to the high opacity of the discs which can hide the star. The cold dust in the discs contributes significantly to far-infrared emissions, displaying a typical spectral index. The small size of these discs indicates they are Keplerian and not expanding with the larger nebulae. In the ISW model, the small discs create an initial imbalance, which, when accelerated by a strong wind, leads to the formation of bipolar lobes. Accurately detecting and resolving these discs requires very high angle measurements that are beginning to be achievable with ground-based telescopes. OH 31.8+4 serves as the main example of bipolar post-AGB stars. It displays two ionized bipolar lobes flanking a central obscured region. This central star exhibits variabilities similar to that of an evolved AGB star. We conducted various observations, including infrared imaging assisted by adaptive optics, OH maser measurements with the MERLIN array, and speculations about data from the VLTI/MIDI. Figure 1 presents the collected data. The first image on the left illustrates the 2.12 micron view, revealing the base of both lobes clearly (though the lobes extend much farther). The obscured dark lane contains various smaller structures with brighter areas interspersed. The image on the right, taken in the L-band, displays a bright core in the central area while showing that the main dark lane is located about an arcsecond south of the core. A thin dark lane can also be seen to the north. The panel marked (c) focuses on the dense core depicted in panel (b). Multiple VLTI/MIDI measurements were taken across this area, and baselined fringes clarified the core's diameter to be around 30–40 mas. OH 31.8+4 is positioned at a distance of 1.3 kpc based on its connection to the M13 open cluster. The VLTI/MIDI results suggest the size of the source is 40–50 AU, fitting expectations for a circumbinary disc, while the dark lane extends significantly farther at 1000 AU, likely serving as a thick torus or a shadow effect from the inner disc's ionization. Sequence (d) shows the OH maser data gathered through MERLIN, reflecting the dark lane accurately. This data, colored to define velocity in m/s, indicates the vast majority of emissions have a blueshift compared to the systemic velocity, suggesting visibility only of OH emissions directly in front. This might occur because the OH masers are amplifying the radio signals from the inner ionized nebula. Velocity measurements increase outward from the center, consistent with expectations from an ISW-driven outflow. OH 31.8+4 is the inaugural source demonstrating all the key aspects predicted by the ISW model: an inner disc consistent with being a circumbinary canal, a bipolar outflow, and a velocity pattern in line with interactions between fast and slow winds. The one absence in this picture is the theoretical binary partner, which manners difficult detection due to the inner region's high opacity.",1
53,"The antennas will connect to the technical building using optical fiber cables. Each antenna will have eight single-mode optical fibers: one for the Data Transmission System (which transmits observational data), one for the Photonics Local Oscillator reference signal, two for monitoring and control signals (via Ethernet), and four spare fibers. There are about 200 locations (antenna pads) where the antennas can be moved. The fibers from each antenna pad are linked at the technical building to a central patch panel, which can accommodate up to 270 connections (see Figure 2). The connections will connect the optical equipment at the antennas with that in the technical building. The maximum distance between the antenna pads and the technical building will be 15 km, while the minimum will be 500 m. This long maximum distance requires minimizing signal loss and limit the number of connections, and the network design must be optimized for these factors. Additionally, the system must account for the Local Oscillator's susceptibility to temperature changes and vibrations, necessitating good thermal and mechanical protection. Consequently, the cable will be directly buried underground, along with the fiber splices, to ensure strong insulation. To maximize insulation benefits from the soil, no ducts or protections that allow air around the cable will be used, so the cable must be designed for direct burial. The cable joints will also be buried, and fiber splices will be housed in protective enclosures to shield against environmental factors. Unlike the Local Oscillator and Data Transmission System, the control and monitoring signal links will stay permanently connected to the equipment, with automatic switching to active pads without manual intervention. A similar automatic connection for the LO and DTS links is being researched, but it likely will not succeed due to stricter requirements and higher costs.","The antennas will connect to the technical building using optical fibre cables. Each antenna will have eight single-mode optical fibres: one for the Data Transmission System (which transmits observational data), one for the Photonics Local Oscillator reference signal, two for monitoring and control signals (Ethernet network), and four spare fibres. There will be about 200 potential locations (antenna pads) for relocating the antennas. Fibres from these antenna pads will link to a central patch panel in the technical building, which can accommodate up to 270 antenna connections. This is where connections are made between the optical equipment at the antennas and in the technical building. The distance between the antenna pads and the technical building will range from 15 km to 500 m. The long maximum distance necessitates low signal loss and fewer splices along the links, so the network design must be optimized for this. The design must also address the sensitivity of the Local Oscillator to temperature changes and vibrations, requiring excellent thermal and mechanical insulation. To achieve this, the cable will be buried underground directly, including the fibre splices. This method ensures good insulation. To make full use of the insulating properties of the soil, no ducts or protections allowing air flow around the cable will be used, meaning the cable must be suitable for direct burial. Cable joints will also be directly buried, and fibre splices, as well as connections at the station vault, will be adequately protected from the environment with suitable enclosures. Unlike the Local Oscillator and the Data Transmission System, the links for monitoring and control signals from all pads will always remain connected to the equipment, with switching to active pads done automatically without manual intervention. While currently being explored, an automatic connection for the LO and DTS links seems unlikely due to stricter requirements and higher costs.",2
54,"The ESO public surveys conducted using the near-infrared 4 m telescope VISTA and the optical 2.6 m telescope VST are ambitious initiatives. They aim to cover a wide range of areas, such as the Vista Hemisphere Survey (VHS) that seeks to survey the entire southern hemisphere with short exposures, as well as deep surveys that focus on smaller areas but capture more detail. The UltraVISTA and the VISTA Deep Extragalactic Observations (VIDEO) survey are notable examples of the latter type. Both wide and deep surveys require similar total observation times, but their specific conditions, such as seeing, sky clarity, moonlight, and Right Ascension range, vary and may be complementary. The scale of these survey projects greatly impacts their operations. An Observing Block (OB) is the standard unit of observation at ESO telescopes, with a maximum execution duration of one hour. Figure 1 illustrates the annual number of OBs prepared, submitted, and scheduled in service mode for all VLT instruments on the 4 Unit Telescopes (UTs), factoring in carry-over and large programmes. On average, we schedule between 3,000 and 5,000 OBs each year per telescope in VLT service mode. However, based on Public Survey Management Plans from the survey principal investigators (PIs), the ESO Survey Team estimates that the anticipated number of OBs is three to five times greater. Additionally, given that there are only six programmes assigned to the VISTA telescope, each survey team must provide over 1,000 OBs every six months. Thus, the current manual editing process for each OB is insufficient, prompting ESO and the VISTA consortium to create new tools for survey Phase 2 support.","The ESO public surveys conducted using the near-infrared 4 m telescope VISTA and the optical 2.6 m telescope VST are ambitious initiatives. They include wide-area surveys with short exposures, such as the Vista Hemisphere Survey (VHS) that aims to cover the entire southern hemisphere, as well as deep surveys that focus on smaller areas but target much deeper observations, like the UltraVISTA and the VISTA Deep Extragalactic Observations (VIDEO) survey. Both types of surveys require similar total observing time, though their specific needs—like visibility, sky clarity, moonlight, and right ascension range—can be complementary. The scale of these survey projects significantly impacts their operations. At ESO telescopes, a unit observation is referred to as an Observing Block (OB), which has a maximum execution time of one hour. The total number of OBs that are prepared, submitted, and scheduled yearly in service mode for all the VLT instruments on the 4 Unit Telescopes (UTs), including carry-over and large programmes, is illustrated in Figure 1. In current VLT service mode operations, we average scheduling between 3,000 and 5,000 OBs per telescope annually. However, according to the Public Survey Management Plans provided by the survey Principal Investigators (PIs), the ESO Survey Team estimates that the expected number of OBs is three to five times greater. Additionally, there are only six programmes for the VISTA telescope, requiring each survey team to prepare more than 1,000 OBs per semester for Phase 2. Thus, the existing manual editing of OB parameters is insufficient, prompting ESO and the VISTA consortium to create new tools to assist with survey Phase 2.",2
